{
  "$schema": "https://json-schema.org/draft/2020-12/schema",
  "$id": "https://etlantic.dev/schemas/profile.json",
  "title": "ETLantic Profile",
  "type": "object",
  "required": ["name", "security_mode"],
  "not": { "required": ["bindings"] },
  "properties": {
    "name": { "type": "string", "minLength": 1 },
    "orchestrator": { "type": "string" },
    "dataframe_engine": { "type": ["string", "null"] },
    "sql_engine": { "type": ["string", "null"] },
    "spark_engine": { "type": ["string", "null"] },
    "allow_trusted_sql": { "type": "boolean" },
    "spark_udf_policy": { "type": "string" },
    "spark_streaming": { "type": "boolean" },
    "required_sql_capabilities": {
      "type": "array",
      "items": { "type": "string" }
    },
    "required_spark_capabilities": {
      "type": "array",
      "items": { "type": "string" }
    },
    "required_orchestrator_capabilities": {
      "type": "array",
      "items": { "type": "string" }
    },
    "assets": {
      "type": "object",
      "additionalProperties": {
        "oneOf": [
          {"type": "string"},
          {
            "type": "object",
            "required": ["provider"],
            "properties": {
              "provider": {"type": "string"},
              "location": {"type": "string"}
            },
            "additionalProperties": false,
            "description": "Object form normalizes to provider://location. Metadata persistence is not shipped in 0.21."
          }
        ]
      }
    },
    "implementation_overrides": {
      "type": "object",
      "additionalProperties": { "type": "string" }
    },
    "secret_providers": {
      "type": "object",
      "additionalProperties": { "type": "string" }
    },
    "observability_providers": {
      "type": "object",
      "additionalProperties": { "type": "string" }
    },
    "run_history_provider": { "type": ["string", "null"] },
    "event_consumers": {
      "type": "object",
      "additionalProperties": { "type": "string" }
    },
    "observability_delivery": {
      "type": "string",
      "enum": ["best_effort", "durable_audit"]
    },
    "resources": {
      "type": "object",
      "additionalProperties": { "type": "string" }
    },
    "secrets": { "type": "object" },
    "plugin_allowlist": {
      "type": "object",
      "additionalProperties": { "type": ["string", "null"] }
    },
    "optimization_pass_allowlist": {
      "type": "object",
      "additionalProperties": { "type": ["string", "null"] },
      "description": "Optimization pass name → optional version pin (production fail-closed when undeclared)."
    },
    "schema_registry_allowlist": {
      "type": "object",
      "additionalProperties": { "type": ["string", "null"] },
      "description": "Schema-registry adapter package → optional version pin (production fail-closed when undeclared)."
    },
    "resource_provider_allowlist": {
      "type": "object",
      "additionalProperties": { "type": ["string", "null"] },
      "description": "Resource provider package → optional version pin (production fail-closed when a provider is selected)."
    },
    "optimization_policy": {
      "type": "string",
      "enum": ["off", "shadow", "apply_accepted"],
      "description": "Whether optimization is off, shadow-compared, or applied after accept (0.45)."
    },
    "tenant": {
      "type": "string",
      "description": "Isolation tenant label for artifact/cache identity (0.20)."
    },
    "environment": {
      "type": "string",
      "description": "Isolation environment label for artifact/cache identity (0.20)."
    },
    "safe_io": {
      "type": "object",
      "description": "SafeIoPolicy overrides (approved roots, budgets, retention).",
      "additionalProperties": true
    },
    "outbound": {
      "type": "object",
      "description": "OutboundPolicy overrides (schemes, hosts, SSRF controls).",
      "additionalProperties": true
    },
    "require_plugin_probe": {
      "type": "boolean",
      "description": "When true, run isolated capability probes before load."
    },
    "security_domain": { "type": "string" },
    "security_mode": {
      "type": "string",
      "enum": ["development", "test", "production"],
      "description": "Explicit security posture for trust and drift fail-closed behavior."
    },
    "validation_policy": { "type": "string" },
    "portable_transform_policy": { "type": "string" },
    "execution_strategy": {
      "type": "string",
      "enum": ["explicit", "adaptive"]
    },
    "placement_targets": {
      "type": "object",
      "propertyNames": { "pattern": "\\S" },
      "additionalProperties": {
        "type": "object",
        "additionalProperties": false,
        "required": ["engine"],
        "properties": {
          "engine": { "type": "string", "pattern": "\\S" },
          "compiler": { "type": ["string", "null"], "pattern": "\\S" },
          "executor": { "type": ["string", "null"], "pattern": "\\S" },
          "connector": { "type": ["string", "null"], "pattern": "\\S" },
          "resource": { "type": ["string", "null"], "pattern": "\\S" },
          "location": { "type": "string", "pattern": "\\S" },
          "security_domain": { "type": "string", "pattern": "\\S" },
          "required_capabilities": {
            "type": "array",
            "uniqueItems": true,
            "items": { "type": "string", "pattern": "\\S" }
          },
          "version_constraints": {
            "type": "object",
            "propertyNames": { "pattern": "\\S" },
            "additionalProperties": { "type": "string", "pattern": "\\S" }
          }
        }
      }
    },
    "eligible_targets": {
      "type": "array",
      "uniqueItems": true,
      "items": { "type": "string", "pattern": "\\S" }
    },
    "adaptive_fallback": {
      "type": "string",
      "enum": ["error", "explicit"]
    },
    "concurrency": { "type": ["integer", "null"] },
    "timeout_seconds": { "type": ["number", "null"] },
    "retry_max_attempts": { "type": ["integer", "null"] },
    "schedule": { "type": "object" },
    "execution": { "type": "object" },
    "metadata": { "type": "object" }
  },
  "additionalProperties": false,
  "allOf": [
    {
      "if": {
        "required": ["execution_strategy"],
        "properties": { "execution_strategy": { "const": "adaptive" } }
      },
      "then": {
        "required": ["eligible_targets"],
        "properties": {
          "eligible_targets": { "minItems": 1 },
          "orchestrator": { "const": "local" },
          "spark_streaming": { "const": false }
        }
      }
    }
  ]
}
