{
  "allow_trusted_sql": false,
  "assets": {},
  "concurrency": null,
  "dataframe_engine": "local",
  "environment": "default",
  "execution": {},
  "implementation_overrides": {},
  "metadata": {},
  "name": "burnin-dev",
  "orchestrator": "local",
  "outbound": {},
  "plugin_allowlist": {},
  "portable_transform_policy": "prefer",
  "require_plugin_probe": false,
  "required_orchestrator_capabilities": [],
  "required_spark_capabilities": [],
  "required_sql_capabilities": [],
  "resources": {},
  "retry_max_attempts": null,
  "safe_io": {},
  "schedule": {},
  "secret_providers": {},
  "secrets": {},
  "security_domain": "default",
  "security_mode": "development",
  "spark_engine": null,
  "spark_streaming": false,
  "spark_udf_policy": "warn",
  "sql_engine": null,
  "tenant": "default",
  "timeout_seconds": null,
  "validation_policy": "default"
}
